<?xml version="1.0" encoding="UTF-8"?>
<directory xmlns="http://www.petergeil.name/NS/UniformAPIDocumentation"
 xmlns:xsi="http://www.w3.org/2001/XMLSchema-instance"
 xsi:schemaLocation="http://www.petergeil.name/NS/UniformAPIDocumentation file:/Volumes/Data/Work/Development/Uniform-API-Viewer/UAPID%20Specification/Schemata/UniformAPIDocumentation.xsd">
    <document>
        <metadata>
            <documentTitles>
                <short>short0</short>
                <full>full0</full>
            </documentTitles>
            <author>author0</author>
            <website-url>http://www.oxygenxml.com/</website-url>
            <description>description0</description>
            <license>license0</license>
        </metadata>
            <manual>
                    <headline>headline0</headline>
                    <headline>headline1</headline>
            </manual>
            <manual>
                    <declaration>declaration0</declaration>
                    <html>html0</html>
            </manual>
    </document>
    <document>
        <metadata>
            <documentTitles>
                <short>short1</short>
                <full>full1</full>
            </documentTitles>
            <author>author1</author>
            <website-url>http://www.oxygenxml.com/</website-url>
            <description>description1</description>
            <license>license1</license>
        </metadata>
            <reference nature="module">
                    <package>
                        <function>
                            <name>name0</name>
                            <paramsDef/>
                            <typeOfReturnValue>void</typeOfReturnValue>
                            <documentation>
                                <code>code0</code>
                                <code>code1</code>
                            </documentation>
                        </function>
                        <property>
                            <name>name1</name>
                            <classOf>classOf0</classOf>
                            <documentation>
                                <html>html1</html>
                                <paragraph>paragraph0</paragraph>
                            </documentation>
                        </property>
                    </package>
                    <property>
                        <name>name2</name>
                        <classOf>classOf1</classOf>
                        <documentation>
                            <paragraph>paragraph1</paragraph>
                            <headline>headline2</headline>
                        </documentation>
                    </property>
            </reference>
            <manual>
                    <code>code2</code>
                    <declaration>declaration1</declaration>
            </manual>
    </document>
</directory>
